{
  "$schema": "./schemas/config.schema.json",
  "Organization": "GiantCroissant-Lunar",
  "Repository": "lunar-snake-hub",
  "Description": "Configuration for lunar-snake-hub Mac Mini infrastructure",
  "MacMini": {
    "TailscaleName": "juis-mac-mini",
    "TailscaleIP": "100.79.159.89",
    "RepoPath": "~/repos/lunar-snake-hub"
  },
  "GLM": {
    "BaseURL": "https://api.z.ai/api/coding/paas/v4",
    "Model": "glm-4.6",
    "EmbeddingModel": "glm-embeddings"
  },
  "Services": {
    "Letta": {
      "Port": 5055,
      "DatabaseURL": "sqlite:///data/letta.db"
    },
    "Qdrant": {
      "Port": 6333,
      "GrpcPort": 6334
    },
    "Gateway": {
      "Port": 5057
    },
    "N8n": {
      "Port": 5678,
      "User": "admin"
    }
  },
  "GitHub": {
    "Enabled": false
  }
}
